#,Song,Artist,BPM,Camelot,Energy,Added At,Duration,Popularity,Genres,Album,Album Date,Dance,Acoustic,Instrumental,Valence,Speech,Live,Loud (Db),Key,Time Signature,Spotify Track Id,ISRC
1,"So Easy (To Fall In Love)","Olivia Dean",140,5B,63,-,02:49,97,"pop soul","The Art of Loving",2025-09-26,75,67,0,57,0,0,-6,D#/E♭ Major,4,6sGIMrtIzQjdzNndVxe397,GBUM72503087
2,"Raindance (feat. Tems)","Dave,Tems",107,3B,74,-,03:39,96,"grime, uk grime, uk drill, drill, afrobeats, afro r&b, alté, afrobeat","The Boy Who Played the Harp",2025-10-23,80,24,6,25,0,10,-7,C♯/D♭ Major,4,3oTuTpF1F3A7rEC6RKsMRz,GBUM72506029
3,"Dancing in the Moonlight","Toploader",119,6B,86,-,03:52,80,"","Onka's Big Moka",2000-00-00,63,6,0,87,0,30,-3,A#/B♭ Major,4,3Fzlg5r1IjhLk2qRw667od,GBBBL9902165
4,"End of Beginning","Djo",160,10B,45,-,02:39,98,"","DECIDE",2022-09-16,69,4,0,91,0,0,-8,D Major,4,3qhlB30KknSejmIvZZLjOD,GBKPL2205058
5,"Thoominnal","Haricharan",100,9A,53,-,04:55,63,"mollywood, tamil pop, tollywood, malayalam pop, telugu pop, kollywood, kannada pop, tamil dance","Mudhugauv",2006-05-13,65,60,0,43,0,0,-8,E Minor,4,6Mk3Saz6OCmOVCvwwAP89S,IND292208172
6,"Mileya Mileya","Sachin-Jigar,Rekha Bhardwaj,Jigar Saraiya,Priya Andrews",125,8B,47,-,04:26,69,"gujarati pop, bollywood, hindi pop, desi, gujarati garba, ghazal, sufi, ","Happy Ending (Original Motion Picture Soundtrack)",2014-04-01,73,24,3,44,0,10,-8,C Major,4,59k0VPRjNwVg6P9HVHMW2N,GBSGZ1502721
7,"Babydoll","Dominic Fike",168,6A,60,-,01:37,96,"","Don't Forget About Me, Demos",2018-10-16,76,11,0,85,10,0,-5,G Minor,4,7yNf9YjeO5JXUE3JEBgnYc,USQX91802457
8,"Arz Kiya Hai | Coke Studio Bharat","Anuv Jain",99,4A,43,-,04:54,83,"indian indie, hindi indie, hindi pop","Arz Kiya Hai | Coke Studio Bharat",2025-08-20,31,66,0,50,0,10,-8,F Minor,4,1bMkimTb47umgNP6xCi4A1,INUM72500914
9,"Flower Moon","Durand Jones & The Indications,Aaron Frazer",87,4A,37,-,04:56,72,"retro soul","Flowers",2025-06-27,66,84,39,59,0,0,-13,F Minor,4,16fiL1QD7x9FeoGu8ktxrz,USJ5G2536705
10,"If You Don't Want My Love","Jalen Ngonda",93,10A,78,-,02:26,76,"retro soul","Come Around and Love Me",2023-09-08,60,13,0,93,0,20,-6,B Minor,4,4A48ckONJNoXU5smWT9CeG,US4GZ2307602
11,"Coastline","Hollow Coves",100,10B,50,-,03:53,78,"indie folk","Wanderlust",2017-03-17,67,63,0,43,0,0,-11,D Major,4,4sDbdBjuYQVdNNB4PiHUPo,AUGSG1600007
12,"Bad Dreams","Teddy Swims",125,4B,68,-,03:04,85,"","I've Tried Everything But Therapy (Part 2)",2025-01-24,71,27,0,62,0,0,-6,G#/A♭ Major,4,3BntzKsnLf2pc0dsvE3Zav,USWB12403749
13,"Nice To Each Other","Olivia Dean",132,8B,74,-,03:29,90,"pop soul","Nice To Each Other",2025-05-30,76,41,0,74,0,30,-7,C Major,4,7gKxCvTDWwV9wBhdeBbr3l,GBUM72502230
14,"High No More","Hajaj",112,3A,27,-,03:18,72,"retro soul","High No More",2021-09-24,88,1,15,81,0,10,-11,A#/B♭ Minor,4,5AQuUEnrfiGM3dfUBTIutY,USUYG1389847
15,"Ek Din Title Track - From  Ek Din ","Arijit Singh,Ram Sampath,Irshad Kamil",110,8A,26,-,04:21,75,"hindi pop, bollywood, desi, bangla pop","Ek Din Title Track (From  Ek Din )",2026-02-23,58,85,0,35,0,10,-8,A Minor,4,2abR4ilhs5JWqZq12SB3GB,INZ031420590
16,"Got You Right","GoldFord",116,1B,65,-,03:25,70,"","Got You Right",2025-02-04,88,44,0,92,0,10,-5,B Major,4,1AMvRbr8thMA47fC6iNJa2,CBEFB2500018
17,"Midas","Maribou State,Holly Walker",115,8A,58,-,03:38,72,"","Portraits",2015-06-01,76,38,38,29,0,10,-5,A Minor,4,6VNooTY5w9A9wg1YUsEbKB,GBCFB1500105
18,"Dooron Dooron","Paresh Pahuja,Shiv Tandan,Meghdeep Bose",190,1B,29,-,03:35,83,"hindi indie, indian indie","Dooron Dooron",2022-01-18,39,80,0,34,0,10,-10,B Major,3,0q5e5KtUOhYQujmhLP0pKd,FR10S2206597
19,"Keep On Movin'","Five,Steve Mac",135,9B,85,-,03:18,63,"tech house","Invincible",1999-00-00,74,4,0,96,0,0,-8,G Major,4,0MjMqYIYzcCteAs4c0BZGy,GBARL9900105
20,"Sea Gets Hotter","Durand Jones & The Indications,Durand Jones,Aaron Frazer",120,5A,54,-,03:17,73,"retro soul","American Love Call",2019-03-01,79,83,0,78,0,30,-7,C Minor,4,5ZK62nSchTamBy8F6HIZov,USJ5G1917710
21,"Alag Aasmaan","Anuv Jain",119,2B,30,-,03:32,71,"indian indie, hindi indie, hindi pop","Alag Aasmaan",2020-07-31,70,87,0,46,0,0,-13,F#/G♭ Major,4,3bQsp4Vr9Rg4fNCx6HPOgX,TCAEZ2083117
22,"Eppadi Vandhaayo (From  Aaromaley )","Siddhu Kumar,Vignesh Ramakrishna,Chinmayi,Anand Aravindakshan",150,5B,26,-,02:49,69,"kollywood, tamil pop, tamil indie, marathi pop, tollywood, telugu pop, bollywood","Eppadi Vandhaayo (From  Aaromaley )",2025-09-29,48,91,0,43,0,10,-11,D#/E♭ Major,3,2A0JZsrJ1Nor5wtoOr9OOR,IND292503304
23,"Lose Control","Teddy Swims",160,11B,60,-,03:30,89,"","I've Tried Everything But Therapy (Part 1)",2023-09-15,56,20,0,24,0,10,-4,A Major,3,17phhZDn6oGtzMe56NuWvj,USWB12302315
24,"Baby Steps","Olivia Dean",95,8B,67,-,03:17,87,"pop soul","The Art of Loving",2025-09-26,70,16,3,39,0,10,-8,C Major,4,5SruEBX3KpgpDvEcIuN53P,GBUM72503092
25,"Young Hearts Run Free","Candi Staton",115,6A,65,-,04:08,75,"","Young Hearts Run Free (US Internet Release)",1976-00-00,65,13,0,85,0,20,-9,G Minor,4,3MFa9idQuY4iJLWsZl3tIQ,USWB19700370
26,"Maahi Ve","A.R. Rahman",131,7B,72,-,04:00,70,"tamil pop, kollywood, bollywood, sufi, hindi pop","Highway",2014-01-22,60,57,0,53,0,10,-7,F Major,4,1sbW5E7w8tnqpYk0Frx8QG,INS181400105
27,"yellowstone (holding you)","Matt Hansen",123,1A,49,-,03:12,71,"","yellowstone (holding you)",2025-06-06,62,14,0,34,0,40,-11,G#/A♭ Minor,4,6Njoyu4X5lMORCxImcam1K,US3DF2567419
28,"Kumbaya","JERUB",97,3B,56,-,03:04,64,"","The Wonder Years",2025-11-07,59,1,0,46,0,10,-8,C♯/D♭ Major,4,4R0VbPpox1uUzPbCWKKFgC,UKW3Z2503409
29,"Too Sweet","Trinix,The Macarons Project",112,6B,43,-,02:44,77,"","Too Sweet",2025-11-28,97,9,0,43,10,10,-10,A#/B♭ Major,4,4Z3F8VnLHzcIRNDRRJmr8P,FXQ892500456
30,"Casio","Jungle",116,3A,49,-,03:54,70,"","For Ever",2018-09-14,82,43,9,77,0,10,-7,A#/B♭ Minor,4,44ZKnfWEkp7wPs035j4Tua,GBBKS1800101
31,"Live For You","Thee Sacred Souls",99,12A,80,-,03:30,72,"retro soul","Got a Story to Tell",2024-10-04,67,17,0,88,0,20,-8,C♯/D♭ Minor,4,2cgHekIPyuKxEEcV72tuy4,US4GZ2407803
32,"Seven Days in Sunny June","Jamiroquai",105,9B,80,-,03:57,69,"acid jazz","Dynamite",2005-06-15,71,20,0,63,0,30,-7,G Major,4,2bwxqGKS5GPXfNanAIRe2p,GBBBN0500206
33,"One Day Like This","Elbow",159,6B,65,-,06:34,63,"","The Seldom Seen Kid",2008-01-01,43,11,0,37,0,10,-6,A#/B♭ Major,4,1OZSVl0JJ1MBzibpuhmmXb,GBUM70710049
34,"Mere Bina","Pritam,Nikhil D'Souza",80,10B,77,-,04:49,72,"bollywood, hindi pop, desi, hindi indie, indian indie","Crook (Original Motion Picture Soundtrack)",2010-09-03,51,65,0,46,0,10,-6,D Major,4,4rSmmC6OYmjVOYxr8ruVWN,INS171000264
35,"Rein Me In (with Olivia Dean)","Sam Fender,Olivia Dean",124,12A,82,-,05:39,83,"pop soul","People Watching (Deluxe Edition)",2025-12-05,50,4,0,55,0,30,-6,C♯/D♭ Minor,4,0MUXBhPUDF8or0kfQ0EHwV,GBUM72503308
36,"Good Vibrations","Nectar Woode",172,11B,22,-,03:49,65,"","Good Vibrations",2023-08-23,73,82,0,52,0,10,-12,A Major,3,3b1LOYktJgqGoy3QMyhOCk,GB6TW2300182
37,"Are You Ready For Love? - Remastered","Elton John",117,10B,75,-,03:32,59,"","Diamonds (Deluxe)",2017-11-10,80,25,0,75,0,10,-5,D Major,4,4IN5LOq2UhGrCk2cBRlsmR,GBUM71702483
38,"Small Change","DON WEST",129,10B,72,-,02:45,71,"retro soul","Small Change",2024-05-29,76,79,3,89,0,30,-9,D Major,4,6iCH68EVZeUm0qlIBp5GOO,FRX452467763
39,"Yun Hi","Mohit Chauhan,Raj Shekhar",140,4B,51,-,04:19,58,"bollywood, hindi pop, sufi, desi","Tanu Weds Manu",2011-02-02,54,49,0,57,0,10,-8,G#/A♭ Major,4,4EHa33GDXoVWGXYOO3cEGm,INS181100249
40,"Star Girl","McFly",156,5B,66,-,03:27,58,"","Motion In The Ocean",2006-01-01,48,0,0,76,0,0,-4,D#/E♭ Major,4,4XJgkeu052kEf1AIfXDlHQ,GBUM70603990
41,"Khat","Navjot Ahuja",135,12B,41,-,04:56,82,"hindi indie, indian indie","Khat",2025-12-03,59,77,0,12,0,10,-10,E Major,3,3gixnmepHSsyAuho34rprN,US39N2556491
42,"Zehnaseeb","Vishal-Shekhar,Chinmayi,Shekhar Ravjiani",78,9B,60,-,03:37,71,"bollywood, desi, hindi pop, tamil pop, marathi pop, kollywood, tollywood, telugu pop","Hasee Toh Phasee (Original Motion Picture Soundtrack)",2014-01-05,62,36,0,42,0,30,-6,G Major,4,3xF15SqY32Mno3UUMBirhU,INS171301714
43,"Valerie (feat. Amy Winehouse) - Version Revisited","Mark Ronson,Amy Winehouse",106,3B,83,-,03:39,83,"","Version",2007-04-16,70,0,0,89,0,10,-5,C♯/D♭ Major,4,6kopmMZiyLmw7h66uXcXR7,GBARL0700173
44,"Someday We Will Dream About Today","The Sways",126,9B,52,-,03:00,70,"","Someday We Will Dream About Today",2025-08-15,69,27,0,78,0,10,-10,G Major,4,2iFJksThouznfkT0094RK2,TCAJX2503180
45,"Tu Hi Mera","Pritam,Shafqat Amanat Ali,Sayeed Quadri",90,1B,86,-,04:32,75,"bollywood, hindi pop, desi, sufi","Jannat 2 (Original Motion Picture Soundtrack)",2012-03-30,62,55,0,87,10,10,-5,B Major,4,1CVqr5LImdmJ1Upt4z08Pm,INS171200195
46,"It Isn’t Perfect But It Might Be - from “Bridget Jones: Mad About the Boy” Original Motion Picture Soundtrack","Olivia Dean",67,4B,79,-,03:36,79,"pop soul","It Isn’t Perfect But It Might Be (from “Bridget Jones: Mad About the Boy” Original Motion Picture Soundtrack)",2025-02-11,61,10,0,53,10,10,-5,G#/A♭ Major,4,1wsLt0uxVHxUMXfwfI6Gsn,GBUM72407901
47,"One More Night","Michael Kiwanuka",108,11A,76,-,03:53,68,"soul","Love & Hate",2016-07-15,68,1,0,94,0,10,-5,F#/G♭ Minor,4,0f2zcrhhHT59aIGQvRlTZ1,GBUM71600963
48,"Love Really Hurts Without You","Billy Ocean",141,7B,91,-,02:59,72,"yacht rock","Billy Ocean (Expanded Edition)",1976-01-05,52,0,0,96,0,0,-4,F Major,4,4GhtDORJiSRYxj6M1bv0vX,GBAHK9700121
49,"Dance The Night Away","The Mavericks",141,12B,75,-,04:22,60,"tejano, latin country","Trampoline",1998-01-01,65,1,0,94,0,10,-9,E Major,4,1N67xd3y9s23vitoiP3Zv5,USMC19701159
50,"Year 3000","Busted",107,1B,84,-,03:16,63,"","Busted",2002-01-01,59,0,0,90,0,0,-7,B Major,4,0zjB7ewBWnMgQDMQpFzt92,GBAAN0201145