#,Song,Artist,BPM,Camelot,Energy,Added at,Duration,Popularity,Genres,Album,Album Date,Dance,Acoustic,Instrumental,Valence,Speech,Live,Loud (db),Key,Time Signature,Spotify Track Id,ISRC
1,"Little Bit Of Rain","Karen Dalton",174,10B,6,2022-03-29,02:36,49,"folk, ambient folk","It's So Hard To Tell Who's Going To Love You The Best",1969-01-01,43,93,7,36,0,10,-22,D Major,3,09g4TuWLxMmrOTt1kzS47Z,USCA26900221
2,"Cry Me A River","Julie London",120,9A,7,2022-03-29,02:58,62,"vocal jazz, jazz, adult standards","Julie Is Her Name",1955-12-01,50,96,0,16,0,10,-15,E Minor,4,7f6AAixCrVar1ZY7RPHDfM,USEM39200253
3,"I'm In The Mood For Love","Julie London",123,8A,5,2022-03-29,02:29,63,"vocal jazz, jazz, adult standards","Julie Is Her Name",1955-12-01,58,96,0,18,0,10,-15,A Minor,4,6crfO56bDm0RjpctUuGs5X,USEM38900296
4,"Solitude","Billie Holiday",98,4B,15,2022-03-29,03:27,67,"jazz, vocal jazz, big band, swing music","Solitude",1956-01-01,46,98,0,19,0,10,-14,G#/A♭ Major,3,30QD4VRP9yEneOh0eGTrtJ,USPR35200072
5,"Everything Happens To Me","Chet Baker",58,9A,17,2022-03-29,05:04,43,"jazz, cool jazz, vocal jazz, jazz ballads","Essential Standards (eBooklet)",2009-01-01,43,92,0,18,0,20,-14,E Minor,4,00jqmEUSISjkugkuFxGiTo,USFI85800035
6,"Si tu vois ma mère - Slow","Sidney Bechet,Claude Luter et son orchestre",80,5B,38,2022-03-29,03:13,55,"jazz, swing music, ragtime, french jazz","Les Années Bechet",1997-05-06,46,81,87,61,0,50,-13,D#/E♭ Major,4,5FWn20xrAQ1IdbA8Dml6pj,FRZ198900010
7,"All of Me","Billie Holiday",107,7A,6,2022-03-29,03:01,60,"jazz, vocal jazz, big band, swing music","Lady Day: The Complete Billie Holiday On Columbia (1933-1944)",2001-10-01,50,97,0,40,0,10,-15,D Minor,5,1LGqJ3nvxpVXDWpEzq4DJD,USSM10104292
8,"Dream A Little Dream Of Me","Ella Fitzgerald,Louis Armstrong",95,8B,15,2022-03-29,03:07,54,"jazz, vocal jazz, swing music, big band, christmas","Ella: The Legendary Decca Recordings",1995-08-29,49,92,0,36,0,10,-14,C Major,3,0KBvapFwuz8gPKu6Gw23WN,USMC15076750
9,"I'll Be Seeing You","Billie Holiday",90,3B,3,2022-03-29,03:31,69,"jazz, vocal jazz, big band, swing music","Billie Holiday",1957-01-01,36,99,6,19,0,10,-20,C♯/D♭ Major,3,4smkJW6uzoHxGReZqqwHS5,USMC14448351
10,"So Tender","Keith Jarrett,Gary Peacock,Jack DeJohnette",87,12A,30,2022-03-29,07:15,47,"jazz, jazz ballads, free jazz, jazz fusion","Standards, Vol. 2",1983-00-00,37,82,84,35,0,10,-20,C♯/D♭ Minor,4,0Dt1B5dNfajRczQKZA87aL,DEB338328901
11,"Summertime","Sidney Bechet",83,5B,14,2022-03-29,04:11,44,"jazz, swing music, ragtime","Jazz Classics",1993-01-01,61,98,91,32,0,0,-17,D#/E♭ Major,4,3RlJx8xwZEyToSuGrygilr,USBN28900036
12,"Time After Time","Chet Baker",181,5A,14,2022-03-29,06:47,0,"jazz, cool jazz, vocal jazz, jazz ballads","Cool Jazz For Hot Nights",2000-01-01,36,96,1,12,0,0,-13,C Minor,3,6VNCUqgNIoFrI32zGyV1tr,GBCWU0600370
13,"April In Paris","Billie Holiday",75,8B,13,2022-03-29,03:05,43,"jazz, vocal jazz, big band, swing music","All Or Nothing At All",1958-01-01,50,93,0,21,0,10,-14,C Major,4,34zhjduFdQFhkRUJ230h9T,USPR35600073
14,"My Way","Frank Sinatra",75,10B,38,2022-03-29,04:36,78,"christmas, big band, adult standards, swing music, jazz, vocal jazz","My Way (Expanded Edition)",1969-03,40,70,0,23,0,10,-7,D Major,4,3spdoTYpuCpmq19tuD0bOe,USRH10902101
15,"Stormy Weather","Etta James",174,5A,36,2022-03-29,03:07,70,"soul, soul blues, blues, vocal jazz","At Last!",1960-00-00,26,61,0,43,0,10,-8,C Minor,3,2IdwQxhJn9ZE4zIotcCefR,USMC16048489
16,"Blue Moon","Billie Holiday",124,4B,27,2022-03-29,03:27,67,"jazz, vocal jazz, big band, swing music","Solitude",1956-01-01,64,98,12,55,0,10,-11,G#/A♭ Major,4,1pZn8AX1WulW8IO338hE5D,USPR35200069
17,"I Fall In Love Too Easily","Chet Baker",129,5A,7,2022-03-29,03:21,68,"jazz, cool jazz, vocal jazz, jazz ballads","Chet Baker Sings",1956-00-00,53,94,0,29,0,0,-19,C Minor,4,0F845nujLVqCb0XMZCh5Pc,USBN28900070
18,"My Funny Valentine - Rudy Van Gelder Remaster 2007","Miles Davis Quintet",70,5A,12,2022-03-29,05:58,59,"jazz, hard bop, cool jazz, bebop, jazz ballads","Cookin' With The Miles Davis Quintet",1957-00-00,55,92,0,24,0,10,-15,C Minor,4,5FYgwqjjq9kPCMj8yArfTr,USFI85600056
19,"Love Is A Losing Game","Amy Winehouse",165,8B,29,2022-03-29,02:35,66,"","Back To Black (Deluxe Edition)",2006-00-00,48,34,1,56,0,10,-17,C Major,4,3uliGwmB52ZA7brgpZMzyH,GBUM70603489
20,"Nothing Can Change This Love","Sam Cooke",65,11B,30,2022-03-29,02:40,72,"motown, soul, classic soul","Mr. Soul",1963-02,37,77,0,44,0,0,-12,A Major,3,6e6Kxot9nHyZ4I8GgmGKII,USRC16202725
21,"That's Life","Frank Sinatra",113,9A,43,2022-03-29,03:07,74,"christmas, big band, adult standards, swing music, jazz, vocal jazz","That's Life",1966-11,56,55,0,66,0,30,-14,E Minor,3,4FmCUATNIarCQh72JYdvnm,USRH10800967
22,"(There Is) No Greater Love","Amy Winehouse",138,12A,23,2022-03-29,02:08,52,"","Frank (Deluxe Edition)",2003-00-00,39,94,0,28,0,10,-13,C♯/D♭ Minor,4,1jLNxsmGsEQAM4CUkHemfS,GBAAN0300495
23,"My One And Only Love","John Coltrane,Johnny Hartman",114,8B,7,2022-03-29,04:55,67,"jazz, hard bop, free jazz, bebop, jazz ballads, cool jazz, vocal jazz","John Coltrane And Johnny Hartman",1963-01-01,47,96,0,25,0,10,-16,C Major,4,0uPkCpuoERqrkBL06Art50,USMC16353721
24,"Fever","Peggy Lee",136,9A,17,2022-03-29,03:19,69,"vocal jazz, swing music, big band, jazz","Things Are Swingin'",1958-11-03,84,23,0,40,0,10,-13,E Minor,4,3aPlQWU07jGgyHaBHVS5TS,USCA20000950
25,"Here Comes the Sun","Nina Simone",117,3B,37,2022-03-29,03:34,55,"vocal jazz, soul jazz, soul, jazz, blues","Here Comes The Sun (Expanded Edition)",1971-00-00,42,72,0,65,0,0,-13,C♯/D♭ Major,4,1x9ahz0ALGHgbN9wwDjmre,USRC11100728
26,"I Want a Little Sugar In My Bowl","Nina Simone",99,2B,31,2022-03-29,02:32,56,"vocal jazz, soul jazz, soul, jazz, blues","Nina Simone Sings The Blues (Expanded Edition)",1967-00-00,63,90,0,30,0,10,-9,F#/G♭ Major,3,3NcJu9876GBJuNU6vJOrbb,USRC16707306
27,"It Hurts Me Too","Karen Dalton",181,11B,6,2022-03-29,03:07,45,"folk, ambient folk","It's So Hard To Tell Who's Going To Love You The Best",1969-01-01,43,94,62,28,0,10,-22,A Major,3,4wACv3JAUdAzmRdGat6ZuK,USCA26900228
28,"A Kiss To Build A Dream On","Louis Armstrong",76,3B,28,2022-03-30,04:31,48,"jazz, swing music, vocal jazz, big band","Hello, Dolly! (Remastered)",1964-10-25,59,85,0,42,0,0,-10,C♯/D♭ Major,4,6GtJqo0vr7DqWOHQtp77cV,USMC16451612
29,"They Can't Take That Away From Me","Ella Fitzgerald,Louis Armstrong",105,5B,14,2022-10-20,04:40,52,"jazz, vocal jazz, swing music, big band, christmas","The Complete Ella And Louis On Verve",1997-05-20,56,87,0,37,0,10,-17,D#/E♭ Major,4,1V4NaFlrUCK49MXcdOcVeS,USPR35600081
30,"Ramona","Patrick Bruel",98,8B,25,2022-10-20,03:14,12,"variété française, chanson, french pop","Entre-deux",2002-06-03,75,84,46,51,0,20,-16,C Major,4,0Uv1bAk08CAowkStu8WfAX,FRR060200019
31,"Time After Time - Vocal Version","Chet Baker",100,8B,5,2022-10-20,02:46,61,"jazz, cool jazz, vocal jazz, jazz ballads","Chet Baker Sings",1956-00-00,50,94,0,26,0,20,-19,C Major,4,4m6OC8u2rC6LMFtFWsME7d,USBN28900129
32,"Fever","Elvis Presley",62,3B,9,2022-10-20,03:35,56,"rockabilly, rock and roll","Elvis Is Back",1960-04-08,71,74,6,39,0,10,-21,C♯/D♭ Major,4,73m8WuJlhzVusTVzJCGaDZ,USRC16007197
33,"Easy Living (with Teddy Wilson & His Orchestra)","Billie Holiday,Teddy Wilson",89,4B,23,2022-10-21,03:02,43,"jazz, vocal jazz, big band, swing music","Lady Day: The Complete Billie Holiday On Columbia (1933-1944)",2001-10-01,64,97,0,66,0,10,-11,G#/A♭ Major,4,3d3aPk50dBMA2YbA7lC92r,USSM10104176
34,"Take Another Little Piece Of My Heart","Dusty Springfield",80,10B,75,2022-10-21,02:36,53,"","Dusty... Definitely (Expanded Edtion)",1968-11-22,48,5,32,80,0,20,-7,D Major,4,0E4UBpsUOZ6Ic4SCxrXz1L,GBF086800756
35,"Backlash Blues","Nina Simone",116,6B,64,2022-10-21,02:28,44,"vocal jazz, soul jazz, soul, jazz, blues","Nina Simone Sings The Blues (Expanded Edition)",1967-00-00,67,80,0,81,0,0,-5,A#/B♭ Major,3,2bdapwYVEGpGWxlx3iooAB,USRC10503536
36,"Walk On The Wild Side","Tok Tok Tok",95,8B,17,2022-10-21,04:38,15,"vocal jazz, jazz pop","Love Again",2005-01-17,73,24,8,43,0,10,-20,C Major,4,78G0LEqrs8HmEwhb75nYXQ,DEA310500047
37,"Ain't No Sunshine","Bill Withers",78,9A,42,2022-10-21,02:06,84,"soul","Just As I Am",1971-05-01,53,46,0,52,10,10,-11,E Minor,4,1k1Bqnv2R0uJXQN4u6LKYt,USSM10000372
38,"Black Coffee","Ella Fitzgerald",176,8B,9,2022-10-30,03:30,36,"jazz, vocal jazz, swing music, big band, christmas","Ella Fitzgerald - First Lady Of Song",1993-04-20,35,98,0,21,0,10,-14,C Major,3,2Rejh16NV462TwiGGf5YNL,USPR36002473
39,"Blue Moon","Julie London",91,10A,4,2022-11-03,02:33,50,"vocal jazz, jazz, adult standards","Julie Is Her Name, Vol. 2",1958-00-00,55,96,0,24,0,10,-19,B Minor,4,5qfEAELRtcWyKjaheHHWQb,USCA25800334
40,"I Wish I Knew How It Would Feel to Be Free","Nina Simone",122,6B,51,2022-11-03,03:08,64,"vocal jazz, soul jazz, soul, jazz, blues","Silk & Soul (Expanded Edition)",1967-00-00,69,75,0,67,0,10,-9,A#/B♭ Major,4,5CKHhg31HcYYhwUeeGqvhq,USRC10503463
41,"Cigarettes and Coffee","Otis Redding",138,8B,28,2022-11-03,04:00,62,"motown, soul, classic soul, soul blues","The Soul Album",1966-04-01,48,23,0,31,0,10,-14,C Major,3,4PFiLGx8jAzcAJxwPLUeZ9,USAT29902027
42,"Jealous Guy","Hurray For The Riff Raff",137,10B,8,2022-11-03,03:27,35,"americana, alt country","My Dearest Darkest Neighbor",2013-07-02,57,90,0,34,0,10,-18,D Major,4,2faT135hfs9Ro4YUlKIG8o,QMQYH1300092
43,"Come Rain or Come Shine","Eric Clapton,B.B. King",193,8B,40,2022-11-05,04:11,0,"blues, blues rock, classic rock, classic blues, soul blues","Riding with the King",2000-06-13,37,52,0,29,0,10,-9,C Major,3,2dAm3t3HT91qhKEgZFhzmv,USRE10000587
44,"Dream A Little Dream Of Me","The Mamas & The Papas",93,9B,31,2022-12-05,03:14,73,"folk rock","The Papas & The Mamas",1968-05-01,41,79,0,35,0,0,-13,G Major,4,27hhIs2fp6w06N5zx4Eaa5,USMC16846393
45,"Love Me Or Leave Me","Nina Simone",86,8B,40,2022-12-05,04:04,61,"vocal jazz, soul jazz, soul, jazz, blues","Let It All Out",1966-01-01,56,84,0,76,0,10,-11,C Major,4,2XzHou7MZzOBQBqjWw86Nt,USPR36500080
46,"It Ain't Over 'Til It's Over","Lenny Kravitz",160,2B,57,2022-12-05,04:02,84,"","Mama Said",1991-04-02,68,42,1,93,0,30,-11,F#/G♭ Major,4,6VnpKLtfNH4Dk09YSGPSyR,USVI29100003
47,"Maybe","Janis Joplin",83,4B,35,2022-12-05,03:41,60,"classic rock, acid rock, psychedelic rock","I Got Dem Ol' Kozmic Blues Again Mama!",1969-09-11,40,23,4,33,0,10,-11,G#/A♭ Major,4,0xGSeBsG4V8Scc5YqpZQ66,USSM16900947
48,"Where To Start","Lou Doillon",180,8B,24,2022-12-05,02:46,55,"french indie pop","Lay Low",2015-10-09,70,59,1,59,0,10,-11,C Major,3,2bhfHrX4IJzF62XKzqZpPX,FRUM71501587
49,"Alone Again (Naturally)","Gilbert O'Sullivan",172,1A,52,2022-12-05,03:36,1,"","Back to Front (Deluxe Edition)",1972-01-01,56,62,0,63,0,10,-7,G#/A♭ Minor,4,4lHQCzdK3VdYQvQZnnRouG,GBEQJ0400002
50,"Sea of Love","Phil Phillips",127,9B,45,2022-12-05,02:22,0,"doo-wop","Born Philip Baptiste",2021-01-08,32,91,0,26,0,10,-10,G Major,3,6c81oulPV6PJxSmB1nrhjd,AUXN22115803
51,"Everything Happens To Me","Chet Baker",118,9B,8,2022-12-05,05:02,0,"jazz, cool jazz, vocal jazz, jazz ballads","It Could Happen To You",1987-01-01,53,90,0,21,0,30,-20,G Major,4,2d0bYxU8jZntgNb9c1fGF5,USFI85800035
52,"Why Try to Change Me Now","Fiona Apple",112,6B,8,2022-12-05,05:16,48,"art pop","The Best Is Yet to Come - The Songs of Cy Coleman",2011-01-04,48,92,0,16,0,10,-15,A#/B♭ Major,4,7fKA60i4JhkavVw7fQFOHS,USSNN1010005
53,"Across The Universe - Remastered 2009","The Beatles",152,3B,41,2022-12-05,03:48,68,"classic rock, psychedelic rock","Let It Be (Remastered)",1970-05-08,26,36,0,86,0,0,-12,C♯/D♭ Major,4,4dkoqJrP0L8FXftrMZongF,GBAYE0601710
54,"Woman - Remastered 2010","John Lennon",80,5B,66,2022-12-05,03:32,64,"christmas","Double Fantasy",1980-11-17,59,38,0,75,0,0,-6,D#/E♭ Major,4,1BrbXIJ7b161oQ0PfC0K32,USTO11000024
55,"Because the Night","Patti Smith",124,10A,76,2022-12-05,03:24,69,"proto-punk","Easter",1978-00-00,47,5,0,47,0,10,-8,B Minor,4,0lIoY4ZQsdn5QzhraM9o9u,USAR17800008
56,"How Deep Is Your Love","PJ Morton",88,1A,46,2022-12-07,03:17,59,"neo soul","Gumbo",2017-04-21,80,71,0,77,0,0,-8,G#/A♭ Minor,4,0loJyuSFr6vVPBQSmLLrrQ,USUYG1135406
57,"How Can You Mend a Broken Heart","Al Green",147,12B,42,2022-12-14,06:23,71,"soul, classic soul, motown, soul blues","Let's Stay Together",1972-00-00,47,51,0,37,0,0,-7,E Major,3,6lUXneXZ9jc3HSMHgd8oqh,US2HK0913707
58,"How Can You Mend A Broken Heart","Al Green",146,12B,45,2022-12-18,06:25,12,"soul, classic soul, motown, soul blues","Notting Hill",1999-01-01,45,27,0,40,0,0,-8,E Major,3,21ws7a9vgbdHskAQXXuRnX,USUG10300596
59,"Nobody Knows You When You're Down And Out","Nina Simone",116,11B,33,2023-02-06,02:38,54,"vocal jazz, soul jazz, soul, jazz, blues","Pastel Blues",1965-10-01,48,89,0,44,0,0,-12,A Major,1,5yMRZqh2HCo5NFbLNt6sD1,USPR36500085
60,"Autumn In New York","Billie Holiday",72,3A,10,2023-02-06,03:44,56,"jazz, vocal jazz, big band, swing music","Recital",1956-01-01,59,96,0,29,0,10,-15,A#/B♭ Minor,4,6o5RbQYhmF4yRRw7ZArxGL,USPR35200080
61,"Love Is A Losing Game - Live At The Mercury Music Awards","Amy Winehouse",90,8B,25,2023-04-30,02:32,43,"","AMY (Original Motion Picture Soundtrack)",2015-10-30,53,87,0,25,0,10,-9,C Major,4,1DYCdxNAVNUCAOlAi7aP5o,GBCAD1500849
62,"Let's Get Lost","Chet Baker",78,8B,37,2023-06-01,03:43,55,"jazz, cool jazz, vocal jazz, jazz ballads","Chet Baker Sings And Plays (Remastered 2004)",1955-01-01,52,84,0,55,0,10,-9,C Major,4,0UZFhlhUMrYyzzyOHkylM3,USBN28900080
63,"Mr. Bojangles","Nina Simone",114,2B,30,2023-06-01,04:59,53,"vocal jazz, soul jazz, soul, jazz, blues","Here Comes The Sun (Expanded Edition)",1971-00-00,46,22,0,25,0,20,-14,F#/G♭ Major,4,5ywoRjfVIlcJiSAxwPT3Pt,USRC11100731
64,"Something - Remastered 2009","The Beatles",133,8B,34,2023-06-01,03:02,78,"classic rock, psychedelic rock","Abbey Road (Remastered)",1969-09-26,41,20,0,38,0,10,-11,C Major,4,0pNeVovbiZHkulpGeOx1Gj,GBAYE0601691
65,"Blues Boys Tune","B.B. King",100,1A,52,2023-06-05,03:29,57,"blues, classic blues, soul blues, blues rock","Blues On The Bayou",1998-01-01,44,6,91,33,0,10,-7,G#/A♭ Minor,4,63wEUQ8SN2S8nx2r21zTnl,USMC19858274
66,"In A Sentimental Mood","Duke Ellington,John Coltrane",108,2A,31,2023-06-05,04:15,68,"jazz, big band, swing music, cool jazz, jazz ballads, hard bop, free jazz, bebop","Duke Ellington & John Coltrane",1963-02,46,94,8,28,0,20,-12,D#/E♭ Minor,4,0E8q2Fx2XuzXCO2NSAppkR,USMC16351954
67,"Black Coffee","Sarah Vaughan",94,3B,16,2023-06-05,03:20,51,"vocal jazz, jazz, jazz ballads","After Hours",1955-04-12,38,97,0,13,0,10,-12,C♯/D♭ Major,3,56IQUfsUskt9VHe6YM6kue,USSM19303944
68,"It's Raining","Irma Thomas",106,9B,27,2023-06-05,02:08,42,"classic soul","Irma Thomas Collection: 1961-1966",1996-01-01,63,72,0,44,0,20,-12,G Major,3,6939d7AvgMNTBS7tiqsdHW,USEM39500370
69,"Jardin d'hiver","Henri Salvador",120,10A,14,2023-06-05,02:48,55,"french jazz, chanson, variété française, french pop","Chambre avec vue",2000-10-15,68,53,2,57,0,20,-17,B Minor,4,7gHRVNiuL66Z6fE6DwZaFT,FRS630000023
70,"Do I Move You?","Nina Simone",163,9A,51,2023-06-05,02:44,48,"vocal jazz, soul jazz, soul, jazz, blues","Nina Simone Sings The Blues (Expanded Edition)",1967-00-00,39,80,0,55,0,20,-5,E Minor,3,0aIcFRGr88cGtlEJBuDub6,USRC16607669
71,"To Know Him Is To Love Him - Live","Amy Winehouse",170,8B,20,2023-06-09,02:25,52,"","Back To Black (Deluxe Edition)",2006-00-00,48,93,0,37,0,0,-9,C Major,3,1Nz1PPjU3ONNEgjg8Pkppg,GBUM70606486
72,"Almost Blue (Live)","Chet Baker",113,8B,1,2023-09-17,07:55,0,"jazz, cool jazz, vocal jazz, jazz ballads","Chet Baker in Tokyo",2014-12-24,37,93,37,7,0,60,-31,C Major,4,3cZwxA3mOdoTyTUjU62dYF,TCACE1507926
73,"Slightly Hung Over","Blues Delight",99,8A,40,2023-09-17,04:45,60,"blues","Rock Island Line",2006-11-27,67,72,0,40,0,30,-7,A Minor,3,6I8EbSSjimK98wiDCMtnBQ,ushm90697054
74,"Let's Get Lost","Chet Baker",78,8A,24,2023-09-17,03:45,42,"jazz, cool jazz, vocal jazz, jazz ballads","Let's Get Lost: The Best Of Chet Baker Sings",1989-01-01,51,77,0,51,0,10,-15,A Minor,4,6EZXO2zjC6KlLbNwc2HDMc,USBN28900080
75,"Say It (Over And Over Again)","John Coltrane Quartet",67,5B,12,2023-09-17,04:15,61,"jazz, jazz ballads, cool jazz, hard bop, free jazz, bebop","Ballads (Deluxe Edition - Rudy Van Gelder Remaster)",1963-00-00,53,96,38,22,0,20,-13,D#/E♭ Major,4,016HKF7A4O7tatoJ9BgZM1,USMC16211166
76,"Almost blue","Ionn Blignault",113,8B,11,2023-09-17,07:33,41,"jazz","Almost blue",2020-12-09,35,89,19,10,0,10,-19,C Major,4,5mGZw3iGsAhtJTFwY6Xm9V,USION2051401
77,"It's Always You - Vocal Version","Chet Baker",82,4B,3,2023-09-17,03:35,61,"jazz, cool jazz, vocal jazz, jazz ballads","Chet Baker Sings",1956-00-00,50,92,0,31,0,10,-22,G#/A♭ Major,4,06UkYE0SZ3Y8zGRFOuWGAe,USBN28900078
78,"As Time Goes By","Billie Holiday",69,9A,3,2023-09-17,03:14,57,"jazz, vocal jazz, big band, swing music","The Complete Commodore Recordings",1997-01-28,59,99,0,35,0,10,-15,E Minor,4,3lO4Z6BSp773vcovgYurHg,USMC14448359
79,"You Go To My Head","Billie Holiday",68,4B,10,2023-09-17,02:54,55,"jazz, vocal jazz, big band, swing music","Solitude",1956-01-01,55,99,0,21,0,10,-16,G#/A♭ Major,4,78MIFwIW5oUNdaL6Sj8hTB,USPR35200097
80,"You're Mine, You!","Chet Baker",79,9B,4,2023-09-18,03:18,52,"jazz, cool jazz, vocal jazz, jazz ballads","Baby Breeze (Expanded Edition)",1965-01-01,33,97,0,18,0,10,-20,G Major,1,5JRDIhGU31EyE4OSUlDtWI,USPR36500031
81,"I Wish You Love - 2004 Remastered/Remixed","Nancy Wilson",115,3A,25,2023-10-19,02:00,58,"vocal jazz, jazz, jazz ballads","Something Wonderful",2004-01-01,66,86,0,65,0,10,-11,A#/B♭ Minor,4,7moJWeYfMTr7iWgSHvwF7Y,USCA20300860
82,"Everything Depends On You","Chet Baker",68,8B,11,2023-10-19,03:25,34,"jazz, cool jazz, vocal jazz, jazz ballads","Baby Breeze (Expanded Edition)",1965-01-01,52,95,0,11,0,10,-15,C Major,4,7GsqpMfeEg024UNF8aQfDF,USPR36486915
83,"Satisfaction","Tok Tok Tok",131,2B,12,2023-10-19,03:40,2,"vocal jazz, jazz pop","Love Again",2005-01-17,80,86,0,35,10,10,-16,F#/G♭ Major,4,0A1dVfZo5r1BDCs0jdKltE,DEA310500045
84,"Tears in Heaven - Acoustic; Live at MTV Unplugged, Bray Film Studios, Windsor, England, UK, 1/16/1992; 2013 Remaster","Eric Clapton",79,11B,34,2023-10-19,04:40,2,"blues, blues rock, classic rock","Unplugged (Deluxe Edition)",1992-08-25,70,80,0,42,0,70,-13,A Major,4,612VcBshQcy4mpB2utGc3H,USRE11300314
85,"You're the One That I Want","Angus & Julia Stone",80,4A,7,2023-10-19,03:14,44,"","Big Jet Plane",2010-05-03,60,90,0,33,0,10,-14,F Minor,4,0yo7SQcWsIdjjgwpx3ZeR2,AUAP11000006
86,"This is un volcán","Russian Red",112,6A,40,2023-11-03,03:26,19,"","This is un volcán",2023-07-10,63,63,28,24,0,10,-12,G Minor,4,2Ey1hs6xJOar2ki7G7dPbO,ES5702300260
87,"Come Rain or Come Shine","Ray Charles",120,5B,22,2023-12-07,03:42,63,"soul, soul blues, blues, classic soul, vocal jazz","The Genius Of Ray Charles",1959-00-00,36,77,0,28,0,50,-13,D#/E♭ Major,4,2htH7r8oqqEwp3BB6oh2cU,USAT20003625
88,"Some Of These Days","Brenda Lee",98,7A,32,2023-12-07,02:23,0,"christmas","The Crazy 50s Vol. 15",2013-07-05,78,78,0,58,0,10,-10,D Minor,4,6i3Jb3cGCeG982ftEmDK7F,DEPZ61311156
89,"Selfless","The Strokes",122,12B,68,2024-01-03,03:42,79,"garage rock, indie rock, alternative rock","The New Abnormal",2020-04-10,54,19,0,9,0,0,-4,E Major,4,2t0wwvR15fc3K1ey8OiOaN,USRC11902727
90,"Città vuota","Mina",109,6A,62,2024-03-31,02:38,58,"italian singer-songwriter","Studio Uno",2009-00-00,72,87,0,72,0,10,-5,G Minor,4,4LrFMFEu8tc8DKm4VXGnJd,ITA646500132
91,"There Will Never Be Another You","Lester Young,Oscar Peterson Trio",83,5A,4,2024-05-21,03:25,63,"jazz, cool jazz, bebop, jazz ballads, hard bop","The President Plays With The Oscar Peterson Trio",1959-06-02,59,98,82,34,0,10,-18,C Minor,4,6oSm3mBWFxJHEnjE2IqhmA,USPR35252010
92,"A Lucky Guy","Rickie Lee Jones",110,3B,31,2024-05-21,04:09,17,"singer-songwriter","Original Album Series",2010-00-00,56,23,0,19,0,10,-10,C♯/D♭ Major,3,6ZvIYtJCrtmRFqmPy9Difa,USWB10101030
93,"Long Blue Light","Leif Vollebekk",143,11B,48,2024-05-21,03:20,67,"","Long Blue Light",2020-11-10,57,53,10,51,0,10,-9,A Major,4,4HOKq0bN93FsAhtZ5Wdq3y,CA0RZ2000141
94,"Georgia On My Mind","Oscar Peterson Trio",99,4B,11,2024-05-21,03:43,63,"jazz, cool jazz, jazz ballads, bebop, hard bop","Night Train (Expanded Edition)",1963-01-01,43,98,90,13,0,10,-24,G#/A♭ Major,4,7p6ZeiNtEHJKmc4YWBZELG,USF096300320
95,"’Tis Autumn","Nat King Cole",117,6A,7,2024-10-12,03:09,46,"christmas, adult standards, vocal jazz","BD Music & Cabu Present Nat King Cole",2006-10-10,50,97,0,15,0,10,-21,G Minor,4,6sQruAh3HYroK1zT8PUrea,FR8X00601036
96,"Suzanne","Leonard Cohen",132,11A,17,2024-10-12,03:49,3,"singer-songwriter","Songs Of Leonard Cohen",1967-12-27,41,92,0,35,0,10,-16,F#/G♭ Minor,4,2L93TdW2GMue1H2zlkt30F,USSM16701039
97,"Blue Train","John Coltrane",136,4B,29,2024-10-12,10:43,54,"jazz, hard bop, free jazz, bebop, jazz ballads, cool jazz","Blue Train",1957-11-01,50,64,0,57,0,10,-15,G#/A♭ Major,4,3zIuHdD8dkh1vPxQu334T7,USBN21200590
98,"It's a Heartache","Bonnie Tyler",119,8B,67,2024-10-12,03:35,69,"","Natural Force (Expanded Edition)",1978-01-01,53,5,0,52,0,0,-6,C Major,4,1Y7VG310Lf5IYP7sVOob4X,GBAJE7700003
99,"Famous Blue Raincoat","Leonard Cohen",119,8A,4,2024-10-13,05:10,1,"singer-songwriter","Songs Of Love And Hate",1971-03-19,47,95,0,18,0,10,-22,A Minor,3,77K5TB5KZmDZCoJCdd1NvE,USSM19919473
100,"Hey, That's No Way to Say Goodbye","Leonard Cohen",139,6B,25,2024-10-14,02:56,0,"singer-songwriter","Songs Of Leonard Cohen",1967-12-27,44,89,0,28,0,10,-13,A#/B♭ Major,4,0wiwCdb8sWzz9ETztz8taE,USSM10013407
101,"Hymn To Freedom","Oscar Peterson Trio",84,6B,12,2024-11-24,05:33,41,"jazz, cool jazz, jazz ballads, bebop, hard bop","Night Train (Expanded Edition)",1963-01-01,55,97,84,20,0,0,-21,A#/B♭ Major,4,1kGQzSasZr4HY5CzjHqCPG,USF096300400
102,"Everybody Loves The Sunshine","Roy Ayers Ubiquity",161,10A,57,2025-03-16,03:59,67,"jazz funk","Everybody Loves The Sunshine (Reissue)",1976-05-12,52,17,0,70,0,10,-10,B Minor,3,5le4sn0iMcnKU56bdmNzso,USPR37602184
103,"Fuir le bonheur de peur qu'il ne se sauve","Jane Birkin",78,8B,22,2025-04-11,03:31,28,"chanson, french pop, variété française","Birkin / Gainsbourg : Le symphonique",2017-01-01,27,97,1,38,0,10,-12,C Major,5,0dlt8tkEB8rOkYTtf5pnCb,FR83X1600008
104,"All Of Me","Oscar Peterson Trio",133,4B,27,2025-04-11,03:22,56,"jazz, cool jazz, jazz ballads, bebop, hard bop","A Jazz Portrait Of Frank Sinatra",1959-01-01,63,89,67,52,0,10,-14,G#/A♭ Major,4,7pCcxxrnJt55nwbhpaTQDX,USPR35982321
105,"Misty","Ella Fitzgerald",88,1A,11,2025-04-19,02:54,51,"jazz, vocal jazz, swing music, big band, christmas","The Complete Piano Duets",2020-03-13,36,100,0,23,0,10,-14,G#/A♭ Minor,1,4kF394GKEnI13QdZBM9mxM,USPR36002481
106,"Oh My Love - Remastered 2010","John Lennon",135,11B,10,2025-04-22,02:48,56,"christmas","Imagine",1971-09-09,53,99,29,18,0,10,-20,A Major,4,0gDyuX5rdHulQTUyrIdSR1,GBAYE1000775
107,"They Say It's Wonderful","John Coltrane Quartet",71,2B,9,2025-04-30,03:02,56,"jazz, jazz ballads, cool jazz, hard bop, free jazz, bebop","Ballads (Deluxe Edition - Rudy Van Gelder Remaster)",1963-00-00,49,99,71,7,0,10,-17,F#/G♭ Major,5,2TFzmt2xRoSd3KNelJcUxZ,USGR10111068
108,"Petite Fleur","The Hot Sardines",117,9B,24,2025-05-05,03:25,43,"swing music, jazz, french jazz","The Hot Sardines",2014-10-07,60,84,2,24,0,10,-14,G Major,4,7EqNQesWLU5NSxVplKoK1b,USUM71412598
109,"I've Got A Crush On You","Ella Fitzgerald",105,3B,11,2025-05-05,03:30,27,"jazz, vocal jazz, swing music, big band, christmas","Ella Fitzgerald Sings The George And Ira Gershwin Song Book",1959-01-01,26,94,0,13,0,10,-20,C♯/D♭ Major,4,7aiS8M1o6UXWMpldCiPBN5,USPR35905253
110,"Lullaby Of Birdland","Sarah Vaughan",123,10A,35,2025-05-06,04:00,55,"vocal jazz, jazz, jazz ballads","Sarah Vaughan",1954-12-01,58,81,0,48,10,10,-12,B Minor,4,5z161QQZMgQxSILnv3QoJk,USPR35400086
111,"Song to the Siren - Take 7","Tim Buckley",68,12B,5,2026-01-30,03:28,55,"folk rock, folk","Works In Progress",1999-00-00,58,85,0,7,0,10,-21,E Major,4,5ckwOX7SVzt9OISbGkD299,USRH10650432
112,"Lost and Lookin'","Sam Cooke",174,8B,13,2026-02-05,02:13,40,"motown, soul, classic soul","Night Beat",1963-08,35,86,0,20,0,10,-11,C Major,3,34EltYEPxM1kwzfvi7PUU9,USRC16306961
113,"Que reste-t-il de nos amours ?","Charles Trenet",112,8B,22,2026-02-06,03:12,48,"chanson, french jazz, variété française","Disque D'or",1992-00-00,50,99,0,32,0,10,-17,C Major,1,3WfBrLPAbt7G60r1n7BZ6L,FRZ114300070
114,"Hallelujah","Jeff Buckley",97,8B,14,2026-02-10,06:53,72,"","Grace",1994-00-00,32,93,0,8,0,10,-10,C Major,3,3pRaLNL3b8x5uBOcsgvdqM,USSM19400915
115,"I Know It's Over","Jeff Buckley",64,5A,24,2026-02-10,07:04,72,"","You and I (Expanded Edition)",2016-11-16,31,83,0,19,0,0,-12,C Minor,4,2RTLIQRc8yogHh08waQDVa,USSM11508362
116,"Leaving the Table","Leonard Cohen",75,8B,18,2026-02-10,03:47,52,"singer-songwriter","You Want It Darker",2016-10-21,55,84,29,22,0,10,-18,C Major,4,7pyCJ0V0kIY57QdlEcM1eO,CAC221600035
117,"And No More Shall We Part - 2011 Remaster","Nick Cave & The Bad Seeds",109,7A,10,2026-02-10,04:00,41,"","No More Shall We Part (2011 Remaster)",2001-04-02,40,64,0,14,0,10,-15,D Minor,4,2P0mtWhvDnwSnXIGD9OWrA,GBAJH1000684
118,"Famous Blue Raincoat","Leonard Cohen",119,8A,4,2026-02-10,05:15,60,"singer-songwriter","Songs of Love and Hate",1971-03-19,47,95,0,18,0,10,-22,A Minor,3,0Oi6TiuKVXRBS0191bEqnu,USSM19919473
119,"You Never Can Tell","Elise LeGrow",108,3B,37,2026-02-10,03:05,43,"","Playing Chess",2018-02-16,68,86,0,47,0,10,-8,C♯/D♭ Major,4,5V6Slm8bHgFA5wINHUZskE,CAAB81701846
120,"It's All Over Now Baby Blue","Marianne Faithfull",111,10B,41,2026-02-10,03:49,47,"","Rich Kid Blues",1985-00-00,65,52,0,45,0,10,-11,D Major,4,7hoWkhuHv9b3jiCbxX1kMm,GBBPJ9800870
121,"Going To A Town","Rufus Wainwright",124,4A,45,2026-02-10,04:04,49,"singer-songwriter","Release The Stars",2007-01-01,56,71,0,20,0,10,-7,F Minor,4,4XTGDKcerI21v4k1Au2H1L,USUM70725561
