#,Song,Artist,BPM,Camelot,Energy,Added at,Duration,Popularity,Genres,Album,Album Date,Dance,Acoustic,Instrumental,Valence,Speech,Live,Loud (db),Key,Time Signature,Spotify Track Id,ISRC
1,"Everything Happens To Me - Complete Take 2","Chet Baker",114,4B,3,2024-02-23,03:38,30,"jazz, cool jazz, vocal jazz, jazz ballads","Chet In Paris: Everything Happens To Me - The Complete Barclay Recording Vol. 2",1988-10-06,51,94,0,16,0,10,-25,G#/A♭ Major,4,1FjIeuSHpU3x2J8cKCbc6r,FRZ015501030
2,"The Best Things in Life Are Free","Erroll Garner",143,4B,31,2023-05-17,03:31,0,"jazz, jazz ballads, cool jazz","The Best Things in Life Are Free",2019-08-30,51,86,94,49,0,10,-14,G#/A♭ Major,4,3z2j8gQJwJlj3nSApcCfSe,USMAR1915809
3,"Red Sails In The Sunset","Erroll Garner",127,7B,23,2023-05-17,02:44,10,"jazz, jazz ballads, cool jazz","Greatest Hits",2011-06-14,58,98,93,77,0,10,-22,F Major,4,3DsfxqlxVjaVHbTgleCpdD,USLN71111444
4,"Undecided","Erroll Garner",82,4A,31,2023-05-17,02:42,30,"jazz, jazz ballads, cool jazz","The Complete Savoy Master Takes",1998-10-06,63,89,95,70,0,10,-14,F Minor,4,2VziQvGi2gTuUdwj81Ubag,USSJ10150082
5,"Misty - Remastered 2020","Erroll Garner",179,7B,14,2023-05-17,02:47,52,"jazz, jazz ballads, cool jazz","Gemini (Octave Remastered Series)",2020-04-17,33,95,88,14,0,0,-20,F Major,1,2yiISACbYnL2hApy1ffKKs,USMAR2016609
6,"Wild Music","Erroll Garner",132,8A,57,2023-05-17,05:06,31,"jazz, jazz ballads, cool jazz","Ready Take One",2016-09-30,50,86,82,57,0,10,-13,A Minor,4,7wS94SSkAxwYiCsauxuqWc,USQX91601711
7,"Back to You","Erroll Garner",89,4B,27,2023-05-17,05:25,19,"jazz, jazz ballads, cool jazz","Ready Take One",2016-09-30,34,93,89,19,0,0,-14,G#/A♭ Major,4,3Z6axggqpYNPDVCJeq2ehI,USQX91601705
8,"Night and Day","Erroll Garner",110,2B,41,2023-05-17,04:25,16,"jazz, jazz ballads, cool jazz","Ready Take One",2016-09-30,61,81,92,26,0,0,-13,F#/G♭ Major,4,42Rb1hcDPf1ZNgEe2Eqt6m,USQX91601710
9,"Chase Me","Erroll Garner",127,8B,45,2023-05-17,02:57,14,"jazz, jazz ballads, cool jazz","Ready Take One",2016-09-30,56,78,62,61,0,20,-15,C Major,1,0RCKsSFtr266z9XcMkZiUe,USQX91601709
10,"Latin Digs","Erroll Garner",121,5A,45,2023-05-17,05:27,17,"jazz, jazz ballads, cool jazz","Ready Take One",2016-09-30,66,82,89,81,0,0,-14,C Minor,4,6yCiQdUrGE34kpeqbE5vIa,USQX91601707
11,"Stella By Starlight","Erroll Garner",107,6B,38,2023-05-17,04:50,16,"jazz, jazz ballads, cool jazz","Ready Take One",2016-09-30,57,80,94,54,0,10,-14,A#/B♭ Major,4,0baJTrGbFuqy25okQmvIIe,USQX91601713
12,"Down Wylie Avenue","Erroll Garner",124,4A,34,2023-05-17,05:29,14,"jazz, jazz ballads, cool jazz","Ready Take One",2016-09-30,63,79,94,44,0,20,-14,F Minor,4,5CdZRlf1Jp6T845AKip2rO,USQX91601712
13,"My One And Only Love","John Coltrane,Johnny Hartman",122,8B,7,2023-05-17,04:54,0,"jazz, hard bop, free jazz, bebop, jazz ballads, cool jazz, vocal jazz","John Coltrane & Johnny Hartman",1963-00-00,47,98,0,20,0,10,-18,C Major,4,1HEGcv63IZ7TPncpVKdVdN,USMC16353721
14,"Chloe","Joe Pass",151,6A,19,2023-05-17,05:21,49,"jazz, bebop, jazz ballads, vocal jazz, hard bop","Intercontinental",2014-07-11,48,94,88,51,0,10,-22,G Minor,4,0cNc2tivyPqzgp13BSM7St,DEPI81302577
15,"My Foolish Heart","Bill Evans Trio",114,11B,12,2023-05-17,04:57,61,"jazz, jazz ballads, cool jazz, hard bop","Waltz For Debby (Original Jazz Classics Remaster 2010)",1961-00-00,40,94,41,14,0,70,-23,A Major,4,6yKkA8HzwWTZ5taIMaG4Nm,USC4R1016848
16,"Maybe Some Other Time","Magnus Ringblom Quartet",69,11B,24,2023-05-17,03:43,40,"jazz","As Life Turns Around",2019-07-26,35,98,7,31,0,10,-10,A Major,4,1ih4edYGz6a5bP9vuabZM4,SE5Q51901315
17,"Enjoy Your Cigar","Magnus Ringblom Quartet",126,5B,37,2023-05-17,03:42,43,"jazz","Sunset Martini",2022-07-15,70,51,85,60,0,10,-14,D#/E♭ Major,4,5WaOOx9Q5BJhJAfQaxnaaN,SE5Q52200770
18,"Last Ride Home","Magnus Ringblom Quartet",90,9B,14,2023-05-17,03:13,44,"jazz","The Gotland Session",2016-06-16,63,93,95,9,0,10,-19,G Major,4,22QZgO76vLjdpZY161iF72,SE5Q51700469
19,"No Other Woman","Magnus Ringblom Quartet",80,1B,0,2023-05-17,02:15,30,"jazz","The Gotland Session",2016-06-16,42,94,94,39,0,10,-22,B Major,4,6DjroQC7VdOOzC1DbwnKL4,SE5Q51700471
20,"Open Mind","Magnus Ringblom Quartet",80,4B,15,2023-05-17,03:43,28,"jazz","Open Mind",2022-03-18,52,98,54,14,0,10,-10,G#/A♭ Major,4,3ODKzLgzGnXzng8SCTadRc,SE5Q52104515
21,"I Know You Know","Esperanza Spalding",89,7A,44,2023-03-15,03:45,0,"vocal jazz, jazz, jazz pop","We Got Soul",2020-07-17,58,74,1,80,0,10,-11,D Minor,4,72jeP3lqhwzXz982e9p4JA,USHU20814002
22,"Autumn Leaves","Chet Baker",187,4A,61,2023-05-17,07:02,54,"jazz, cool jazz, vocal jazz, jazz ballads","Jazz Moods - Cool",1974-00-00,35,79,45,60,0,10,-11,F Minor,4,1QlTNF43OyKK9BorIRsJ8o,USSM10021825
23,"The Last Time I Saw Paris","Johnny Hodges",82,8B,1,2023-05-20,02:54,53,"jazz, jazz ballads, cool jazz, swing music","Not So Dukish",1958-11-20,55,99,6,52,0,10,-21,C Major,4,1CgkKs5fgX1BiYyYZ6ZzZE,USPR35800048
24,"She's Alive","Bremer/McCoy",59,7A,3,2023-05-20,02:11,40,"ambient jazz","Forsvinder",2016-09-17,51,99,93,25,0,10,-28,D Minor,4,1GLnM2xHIG9DdLGESEEA6n,USAR10301004
25,"I Fall In Love Too Easily","Bill Evans Trio",103,8A,8,2023-05-20,02:42,0,"jazz, jazz ballads, cool jazz, hard bop","Moon Beams [Original Jazz Classics Remasters]",1962-00-00,48,96,87,12,0,10,-19,A Minor,4,1wnbi9NzQPBCobZ6OYCpqH,USC4R1200699
26,"I Can't Get Started","Lester Young,Oscar Peterson Trio",117,8B,2,2023-05-20,03:37,56,"jazz, cool jazz, bebop, jazz ballads, hard bop","The President Plays With The Oscar Peterson Trio",1959-06-02,59,98,69,17,0,10,-21,C Major,4,0kC4Rrdb4B4hAgt3PMoARe,USF095925110
27,"Blue And Sentimental","Oscar Peterson",70,2A,11,2023-05-20,02:26,58,"jazz, jazz ballads, cool jazz, bebop, hard bop","Oscar Peterson Plays Count Basie",1956-01-01,55,98,87,12,0,10,-25,D#/E♭ Minor,4,78ntGe4xyecZHg9exQWwK6,USGR10301258
28,"Michelle","Yusef Lateef",77,7A,9,2023-05-20,01:44,54,"jazz, hard bop, free jazz, avant-garde","Suite 16",1970-00-00,39,98,92,22,0,10,-21,D Minor,3,3YmxwafE7wiBGOM7WnWdY3,USAT20402472
29,"Making Sure","Magnus Ringblom Quartet",117,7B,16,2023-05-20,03:07,33,"jazz","The Gotland Session",2016-06-16,62,92,78,27,0,10,-15,F Major,4,2lEQG1h0oDbydovy9mwBFQ,SE5Q51700476
30,"I'm In The Mood For Love","Erroll Garner",135,3B,11,2023-05-20,02:55,50,"jazz, jazz ballads, cool jazz","The Complete Savoy Master Takes",1998-10-06,56,90,80,36,0,10,-15,C♯/D♭ Major,4,50G4bmpZt73jslY5PzymvY,USSJ10150079
31,"Dreamin'","Hara Noda",118,7B,13,2023-05-20,02:29,41,"jazz, ambient jazz","Catcher",2019-08-16,62,97,56,22,0,10,-18,F Major,4,6oJ3j2m4kCHpMZhOY5jx8d,SE5Q51901773
32,"Don't Know Why","Stephen Rogerson",151,7B,12,2023-05-20,02:20,40,"jazz","Moon Over Brooklyn",2019-07-22,53,96,94,26,0,10,-20,F Major,4,7e9e6hczmTaB9bYrTJMcHe,QZAKB1912112
33,"For All We Know","Ahmad Jamal",80,8B,13,2023-05-20,02:47,48,"jazz, cool jazz, hard bop","Happy Moods",1960-01-07,60,93,92,20,0,10,-20,C Major,4,086RZ0U22i29HR5bj0sWSB,USUM71015152
34,"Fried Chicken","Magnus Ringblom Quartet",95,4A,54,2023-05-20,02:57,11,"jazz","Just Because",2021-05-07,59,89,79,23,0,10,-8,F Minor,4,5e9E9fDLObiPAS70ejrOqz,SE5Q52100528
35,"Indiana","Erroll Garner",103,4B,28,2023-05-20,02:06,10,"jazz, jazz ballads, cool jazz","Body & Soul",1991-03-25,64,99,88,74,0,10,-16,G#/A♭ Major,4,3cKlco0H76WKBjovid48k0,USSM10023462
36,"Georgia On My Mind","Oscar Peterson Trio",99,4B,11,2023-05-20,03:43,63,"jazz, cool jazz, jazz ballads, bebop, hard bop","Night Train (Expanded Edition)",1963-01-01,43,98,90,13,0,10,-24,G#/A♭ Major,4,7p6ZeiNtEHJKmc4YWBZELG,USF096300320
37,"A Day In The Life","Wes Montgomery",98,8A,36,2023-05-21,05:49,51,"jazz, hard bop, cool jazz, bebop, jazz ballads","A Day In The Life",1967-01-01,48,56,30,35,0,0,-11,A Minor,4,5FBf12F4ry9TXoZAvISu6F,USWWW0128924
38,"In Your Own Sweet Way","Wes Montgomery",122,5B,7,2023-05-21,04:51,41,"jazz, hard bop, cool jazz, bebop, jazz ballads","Incredible Jazz Guitar",2000-01-01,57,99,91,8,0,10,-22,D#/E♭ Major,4,392OK8Qdmos0wNDrduiwy0,USFI86000100
39,"Windy","Wes Montgomery",134,6B,40,2023-05-21,02:22,33,"jazz, hard bop, cool jazz, bebop, jazz ballads","A Day In The Life",1967-01-01,77,67,1,67,0,0,-12,A#/B♭ Major,4,2dUCI2pj2CmMem7v8Ul8BO,USAM16700380
40,"Passeggiata","Giovanni Fusco",87,4A,14,2023-06-12,01:42,34,"","L'Eclisse (Original Motion Picture Soundtrack)",1962-00-00,40,98,82,51,0,10,-21,F Minor,3,7n33ThD673JdDkDAlx9bGq,ITC000402632
41,"My Funny Valentine","Seal",141,5A,22,2023-06-14,04:32,53,"","Standards (Deluxe)",2017-11-10,35,88,0,23,0,10,-11,C Minor,4,3rSygnXIRbxtJ9suj12MqW,GBUM71703949
42,"Kissing a Fool","George Michael",117,7B,27,2023-12-06,04:35,0,"","Ladies And Gentlemen... The Best Of George Michael",1998-11-09,39,17,0,17,0,10,-14,F Major,3,4ZCaO5I6XdIHb0X2UwNDtZ,GBBBM8702009
43,"Lazy Afternoon","Irene Kral",0,4A,4,2024-02-13,02:53,43,"vocal jazz, jazz","The Band And I",1959-01-01,0,91,0,0,0,10,-18,F Minor,0,7K0EOXrr9E0bR70LQlr8KA,USBN20200205
44,"Everything happens to me","Duke Jordan",73,7B,23,2024-02-23,05:43,45,"hard bop, jazz, jazz ballads, bebop, cool jazz","Flight To Denmark",1990-00-00,54,94,93,13,0,10,-18,F Major,4,5y9SsiwEDr8oPdOBbBBIyN,DKARS9003403
45,"It's Easy To Remember","John Coltrane Quartet",69,4A,13,2024-02-23,02:45,63,"jazz, jazz ballads, cool jazz, hard bop, free jazz, bebop","Ballads (Deluxe Edition - Rudy Van Gelder Remaster)",1963-00-00,50,93,1,22,0,10,-11,F Minor,4,1lZ41PumDFX0e82XTGx4sE,USMC16253796
46,"Souvenir d'Italie","Lelio Luttazzi",0,9B,44,2024-08-30,01:12,1,"jazz","Le mie preferite",2009-01-01,0,69,95,0,0,30,-13,G Major,0,6CeajvxcjyZ46cGbrKwq9n,IT0660700005
47,"En Bleu Marine","Paolo Conte",78,6B,27,2024-08-30,01:32,36,"italian singer-songwriter, singer-songwriter","Amazing Game - Instrumental Music",2016-10-14,51,96,93,32,0,10,-13,A#/B♭ Major,4,14fOnd3ycVP4OM7K180XM3,ITR011600055
48,"Scenes from an Italian Restaurant","Billy Joel",98,7B,93,2024-11-15,07:36,63,"soft rock","The Stranger (Legacy Edition)",1977-00-00,42,41,0,34,10,10,-5,F Major,4,3utq2FgD1pkmIoaWfjXWAU,USSM17700372
49,"I Fall In Love To Easily","Chet Baker",132,4A,19,2025-05-08,03:18,0,"jazz, cool jazz, vocal jazz, jazz ballads","My Funny Valentine",2011-07-01,53,95,1,25,0,10,-11,F Minor,4,1Rvg3MzzwrQpW6zDbV4ubn,GBBXS0804442
50,"Night And Day","Oscar Peterson",88,2B,21,2025-05-08,02:30,44,"jazz, jazz ballads, cool jazz, bebop, hard bop","Oscar Peterson Plays The Cole Porter Songbook",1959-00-00,63,95,90,37,0,10,-20,F#/G♭ Major,4,3A1NOwqErSnpNuvdeW1RHy,USPR35982306
51,"Everything Happens to Me","Chet Baker",116,9B,19,2023-05-17,05:05,49,"jazz, cool jazz, vocal jazz, jazz ballads","Chet Baker Sings: It Could Happen To You [Original Jazz Classics Remasters] (OJC Remaster)",2010-01-01,51,81,0,16,0,10,-15,G Major,4,4Y5fyQ5fBysC32Na5sZT3J,USC4R1016840