#,Song,Artist,BPM,Camelot,Energy,Added at,Duration,Popularity,Genres,Album,Album Date,Dance,Acoustic,Instrumental,Valence,Speech,Live,Loud (db),Key,Time Signature,Spotify Track Id,ISRC
1,"This Will Be (An Everlasting Love)","Natalie Cole",127,4B,62,2024-04-23,02:51,74,"quiet storm","Inseparable",1975-01-01,69,23,0,90,0,0,-11,G#/A♭ Major,4,0PDCewmZCp0P5s00bptcdd,USCA28700188
2,"Best of My Love","The Emotions",115,8B,71,2024-04-23,03:40,70,"motown, disco","Rejoice",1977-06-10,78,45,14,97,0,0,-7,C Major,4,2M2WJ7gBlcKNxdhyfPp9zY,USSM17700716
3,"Got to Be Real - Single Version","Cheryl Lynn",115,7B,71,2024-04-23,03:43,57,"disco, post-disco","Cheryl Lynn (Expanded Edition)",1978-07-17,83,20,4,90,0,10,-7,F Major,4,3eudp9ZxZAGaDBOuWGrW2D,USSM17801251
4,"Isn't She Lovely","Stevie Wonder",119,12A,69,2024-04-23,03:19,72,"motown, classic soul, soul","The Definitive Collection (Deluxe Edition)",2002-10-29,75,20,0,90,0,0,-9,C♯/D♭ Minor,4,3NlLmKBJozwoi0k03Feb1N,USMO19682655
5,"How Will I Know","Whitney Houston",119,2B,54,2024-04-23,04:29,76,"","Whitney Houston",1985-02-14,83,20,0,93,0,60,-13,F#/G♭ Major,4,5tdKaKLnC4SgtDZ6RlWeal,USAR18500150
6,"My Girl","The Temptations",105,8B,42,2024-04-23,02:45,81,"motown, classic soul, soul","The Temptations Sing Smokey",1965-03-22,57,64,0,69,0,10,-11,C Major,4,745H5CctFr12Mo7cqa1BMH,USMO16490001
7,"I Want You Back","The Jackson 5",197,4B,54,2024-04-23,02:56,80,"motown, christmas","Diana Ross Presents The Jackson 5",1969-12-18,47,31,0,89,0,30,-14,G#/A♭ Major,4,5LxvwujISqiB8vpRYv887S,USMO19400306
8,"Signed, Sealed, Delivered (I'm Yours)","Stevie Wonder",109,7B,60,2024-04-23,02:41,4,"motown, classic soul, soul","Signed, Sealed And Delivered",1970-08-07,68,5,0,83,0,10,-11,F Major,4,2eF8pWbiivYsYRpbntYsnc,USMO17082643
9,"You Can't Hurry Love","The Supremes",97,6B,71,2024-04-23,02:47,70,"motown, northern soul, classic soul, soul","The Supremes A' Go-Go (Expanded Edition)",1966-08-25,63,30,0,66,0,0,-9,A#/B♭ Major,4,1OppEieGNdItZbE14gLBEv,USMO16600346
10,"I'm Coming Out","Diana Ross",110,7B,83,2024-04-23,05:23,73,"motown, disco","Diana",1980-05-22,72,19,43,77,0,0,-9,F Major,4,3SnGymj6ijE2iuUfWxLo1q,USMO18000073
11,"For Once In My Life","Stevie Wonder",110,2B,52,2024-04-23,02:49,73,"motown, classic soul, soul","For Once In My Life",1968-12-01,52,20,0,85,0,50,-12,F#/G♭ Major,4,4kP69y3GKHi9tXckfgp4bK,USMO16800531
12,"Blame It on the Boogie","The Jacksons",113,3B,64,2024-04-23,03:35,76,"disco, motown, philly soul","Destiny",1978-12-17,77,8,0,88,0,0,-10,C♯/D♭ Major,4,3qI94hINNNeb4S7xQi18lS,USSM17801024
13,"Boogie Shoes - 2004 Remaster","KC & The Sunshine Band",120,12B,80,2024-04-23,02:12,61,"disco","KC & the Sunshine Band",1975-07-06,93,50,38,97,0,0,-11,E Major,4,4qlfHfF422rd3I1FOs6N4s,GBAYE0400441
14,"Ain't No Mountain High Enough","Diana Ross",99,5A,79,2024-04-23,03:35,58,"motown, disco","Diamond Diana: The Legacy Collection",2017-11-17,40,19,0,38,0,30,-5,C Minor,4,1KbuhBnzMHp4eq1q6flhWd,USMO17000349
15,"Lovely Day","Bill Withers",98,11B,65,2024-04-23,04:17,81,"soul","Menagerie",1977-10-29,69,29,0,71,0,10,-8,A Major,4,0bRXwKfigvpKZUurwqAlEh,USSM10207844
16,"I'm Every Woman","Chaka Khan",114,5A,89,2024-04-23,04:09,71,"","Chaka",1978-00-00,60,4,0,73,0,30,-7,C Minor,4,1oFiPGBafH9Woo9AMwgBSl,USWB17800019
17,"You Sexy Thing","Hot Chocolate",106,7B,73,2024-04-23,04:04,75,"","Hot Chocolate",1975-00-00,79,52,0,96,0,10,-5,F Major,4,714hERk9U1W8FMYkoC83CO,GBAYE0900553
18,"Don't Go Breaking My Heart","Elton John,Kiki Dee",131,7B,84,2024-04-23,04:35,81,"","Rock Of The Westies",1975-10-24,73,15,0,78,0,0,-9,F Major,4,7HW5WIw7ZgZORCzUxv5gW5,GBALX7600007
19,"We Are Family - 1995 Remaster","Sister Sledge",119,6A,89,2024-04-23,03:36,70,"disco, philly soul","We Are Family (1995 Remaster)",1995-00-00,78,30,0,82,0,20,-5,G Minor,4,5IKLwqBQG6KU6MP2zP80Nu,USAT20102166
20,"Upside Down","Diana Ross",108,4A,86,2024-04-23,04:05,78,"motown, disco","Diana",1980-05-22,87,18,3,88,0,0,-9,F Minor,4,3pbtBomO4Zt5gGiqsYeiBH,USMO18000379
21,"It's Not Unusual","Tom Jones",93,8B,72,2024-04-23,01:59,72,"","Along Came Jones",1965-05-01,48,60,0,91,0,10,-10,C Major,4,3TlIt0ReIxPsVZcOEivT5U,GBF076520010
22,"Night Fever - From  Saturday Night Fever  Soundtrack","Bee Gees",109,12A,80,2024-04-23,03:32,78,"disco","Greatest",1979-01-01,73,3,0,89,0,0,-7,C♯/D♭ Minor,4,5KgbyD2lQQlIupAaPjgiXg,NLF057790035
23,"Respect","Aretha Franklin",115,8B,56,2024-04-23,02:27,75,"soul, motown, classic soul","I Never Loved a Man the Way I Love You",1967-03-10,81,16,0,97,0,0,-5,C Major,4,7s25THrKz86DM225dOYwnr,USAT20801240
24,"Young Hearts Run Free","Candi Staton",115,6A,65,2024-04-23,04:08,75,"","Young Hearts Run Free (US Internet Release)",1976-00-00,65,13,0,85,0,20,-9,G Minor,4,3MFa9idQuY4iJLWsZl3tIQ,USWB19700370
25,"(Your Love Keeps Lifting Me) Higher & Higher","Jackie Wilson",96,10B,68,2024-04-23,02:59,67,"motown, northern soul, classic soul, soul, doo-wop","Higher And Higher",1967-00-00,63,32,0,94,0,0,-7,D Major,4,5qyq1H5OPMlfuvZQ1wQNo7,USBWC0010022
26,"Love Train","The O'Jays",123,8B,57,2024-04-23,02:58,67,"philly soul, classic soul, motown, quiet storm, soul","Back Stabbers",1972-01-01,74,19,0,68,0,10,-10,C Major,4,28285KFbyCq8sJofn58qlD,USSM17200048
27,"Let's Hear It for the Boy - From  Footloose  Original Soundtrack","Deniece Williams",123,8B,49,2024-04-23,04:22,65,"","Let's Hear It for the Boy (Expanded Edition)",1984-04-16,81,8,0,71,0,0,-9,C Major,4,4VyU9Tg4drTj2mOUZHSK2u,USSM10027607
28,"I Wish","Stevie Wonder",106,3A,72,2024-04-23,04:12,70,"motown, classic soul, soul","Songs In The Key Of Life",1976-09-28,82,8,0,89,0,0,-10,A#/B♭ Minor,4,687YZan9Gol1UVvbpUSO6Y,USMO17682657
29,"Let's Go Round Again","Average White Band",128,10A,70,2024-05-27,04:56,48,"funk","Shine",1980-00-00,71,8,0,96,0,30,-7,B Minor,4,1jyFhPbKXwWAFEyg4X2ymb,GBBLG8000323
30,"It Ain't Over 'Til It's Over","Lenny Kravitz",160,2B,75,2024-05-27,04:02,57,"","Greatest Hits",2000-00-00,66,28,0,93,0,30,-6,F#/G♭ Major,4,3aZPzF7Sr0zy3K0EkKyEzk,USVI29100003
31,"Million Dollar Bill","Whitney Houston",120,10A,75,2024-05-27,03:23,56,"","I Look To You",2009-08-28,71,5,0,77,10,0,-4,B Minor,4,78Liq9m8u6xjuamJIeznTd,USAR10900283
32,"The Boss","Diana Ross",124,9A,91,2024-05-27,04:01,56,"motown, disco","The Boss (Expanded Edition)",1979-05-23,64,24,0,83,0,20,-4,E Minor,4,5kfQK1Vb1mKSwzVn32Tarj,USMO17984678
33,"Love Grows (Where My Rosemary Goes)","Edison Lighthouse",109,11B,82,2024-05-30,02:54,75,"","Love Grows (Where My Rosemary Goes) & Other Gems",1970-01-01,57,40,0,75,0,0,-5,A Major,4,5Ts1DYOuouQLgzTaisxWYh,GBBPJ9800675
34,"Le Freak - 2018 Remaster","CHIC",119,9B,64,2024-06-25,05:31,70,"disco, funk","C'est Chic (2018 Remaster)",1978-08-11,91,3,0,90,0,0,-11,G Major,4,7Kszjzps0xbQXyo1pO4KfE,USRH11803129
35,"Love Has Fallen on Me","Chaka Khan",87,4B,70,2024-08-15,04:55,34,"","Chaka",1978-00-00,41,39,0,56,10,10,-8,G#/A♭ Major,4,7s1RAjj0ReNlRn4ZVBzEif,USWB17800032
36,"Never Knew Love Like This Before","Stephanie Mills",114,1B,57,2024-10-20,05:25,55,"quiet storm, classic soul, post-disco","The Best Of Stephanie Mills",1995-01-01,74,38,0,74,0,0,-14,B Major,4,4EUlszQIxlPwiHJ6e6j6Gy,USPR38002470
37,"Midnight Train to Georgia","Gladys Knight & The Pips",92,3A,38,2024-10-22,04:39,73,"motown, classic soul, soul, northern soul","Imagination (Expanded Edition)",1973-00-00,60,27,0,45,0,10,-12,A#/B♭ Minor,4,7MF7QAodbGzNYav5ZfIhAY,USBR17300001
38,"I Can't Help Myself (Sugar Pie, Honey Bunch)","Four Tops",128,8B,60,2024-10-28,02:40,74,"motown, northern soul, classic soul, soul","Four Tops - Second Album",1965-00-00,67,25,0,97,0,10,-9,C Major,4,6b6IMqP565TbtFFZg9iFf3,USMO16582593
39,"Rich Girl","Daryl Hall & John Oates",170,7B,68,2024-11-28,02:22,78,"yacht rock, soft rock","Bigger Than Both Of Us",1976-08-01,57,46,0,82,10,0,-7,F Major,4,0qRR9d89hIS0MHRkQ0ejxX,USRC17607760
40,"Move On Up","Curtis Mayfield",139,10A,97,2025-01-28,02:45,61,"classic soul, soul, motown, funk","People Never Give Up",2020-10-30,54,42,0,93,0,10,-6,B Minor,4,2cK7SJ2O3CqDRHeixvFKgh,USRH11509321
41,"Rock the Boat","Hues Corporation",107,5B,58,2025-04-10,03:22,65,"disco","Freedom for the Stallion (Expanded Edition)",1973-00-00,60,26,0,88,0,10,-10,D#/E♭ Major,4,7fu3Tv5rcoGD1PZV7s57WW,USRC17308512
42,"Can't Get Enough Of Your Love, Babe","Barry White",112,7B,78,2025-04-17,04:34,73,"disco, soul, classic soul, quiet storm, philly soul","Can't Get Enough",1974-02-15,73,11,11,80,0,0,-8,F Major,4,3mWpUEBYnv9SIFWfixSJFx,USPR37407059
43,"All Night Long (All Night) - Single Version","Lionel Richie",109,3B,60,2025-04-17,04:18,73,"motown","Back To Front",1992-01-01,75,15,0,83,0,0,-12,C♯/D♭ Major,4,4czNORk5MjW5WOn98bki32,USMO18390005
44,"Turn Your Love Around","George Benson",206,8A,39,2025-04-22,03:50,62,"smooth jazz, yacht rock, jazz funk, soul jazz","The George Benson Collection",2009-07-14,63,33,0,77,0,10,-14,A Minor,4,6a899bXlCuViXW2Qs8Rdqo,USWB10902422
45,"You Make Me Feel Like Dancing","Leo Sayer",96,1A,73,2025-05-02,03:41,63,"soft rock, yacht rock","Endless Flight",1976-00-00,73,8,0,71,0,10,-5,G#/A♭ Minor,4,3DZ11M7LSpVQzYHnFx3i95,GBBLG7600256
46,"Love, Love, Love","Donny Hathaway",95,4B,71,2025-07-21,03:22,62,"soul, classic soul","Extension of a Man",1973-00-00,49,69,0,64,0,10,-8,G#/A♭ Major,4,3mc4nFeBX4hvuYbPsoS4GK,USEE10180230
47,"Too Hurt to Cry","Candi Staton",147,8B,45,2025-10-15,03:14,40,"","Stand By Your Man",1971-00-00,61,32,0,94,0,0,-14,C Major,4,3m005rMxTmSLlzW81R5KK1,USCA27100054
48,"I Wanna Be Your Lover","Prince",115,12A,51,2026-01-04,05:47,64,"funk, funk rock","Prince",1979-10-19,81,4,8,73,0,0,-9,C♯/D♭ Minor,4,4yrM5BVyJzy5Ed4GPO6e8j,USWB19903516
49,"I Like It","DeBarge",175,11B,73,2026-01-08,04:39,66,"quiet storm","All This Love",1982-04-28,68,45,0,83,0,20,-5,A Major,4,1c5KZhtOAOH7eFOlBekNhS,USMO18500567
50,"More Than A Woman","Bee Gees",106,9B,68,2026-02-20,03:17,79,"disco","Greatest",1979-01-01,63,16,0,70,0,80,-6,G Major,4,49OMJ1prsRA7ZYgrAjz70c,NLF057790033